"Congratulations to all of the authors on this year’s shortlist for @ecfchess book of the year, including @gmmds &amp; @NatashaRegan123 for Game Changer, their brilliant book about #AlphaZero https://t.co/chyv1Wa18N"
"The wonderful @FryRsquared has been working on this podcast with the team for a while and I’m really excited to see the series launch! It was great fun talking to Hannah for episode 8, and I think she's captured @DeepMindAI's culture and research brilliantly. https://t.co/EVU6J8AfhY"
"Great to see this collaboration between our Science team and ecologists, to develop an AI tool to help speed up much needed conservation research in the Serengeti! The team will be presenting this work at @DeepIndaba later this month
https://t.co/BkeXLiC7iZ"
Had fun talking to @WiredUK and @GregWilliams718 about what makes DeepMind special and how AI could help accelerate breakthroughs in science and medicine. Amazing to step back and reflect on how much we’ve learned over the past 10 years and all that is still to come. https://t.co/0Q00hAILb5
"Really excited to see this health research published in @nature - it’s a huge achievement for the team, and a great example of using machine learning and AI for positive impact. https://t.co/fC9G1BDrt1"
"Turing’s story reminds us that though we’ve made progress, we mustn’t stop until everyone regardless of background, sexual orientation, gender, race or disability can achieve their full potential, something I'm giving a lot of thought to at the moment. 3/3"
Turing’s treatment by the country he served was a tragedy - the new £50 note is a powerful symbol of the recognition he deserves as a national hero for his impact during WW2 &amp; on computer science &amp; AI. 2/3
"It was an honour and a joy to be at @sim_manchester today to celebrate Alan Turing, one of Britain’s greatest scientists, my personal scientific hero &amp; someone who I think stands comparison to Newton and Darwin. 1/3
https://t.co/G2IrtZheQ4"
"Really enjoyed speaking to the @Economist’s Kenn Cukier about chess, @NatashaRegan123 @gmmds excellent #GameChanger book on #AlphaZero, and how the ideas behind it might one day be applied to accelerate scientific discovery https://t.co/GktdUVcV18"
"Incredible to see the world chess champion @MagnusCarlsen on an amazing run of 7 consecutive elite tournament wins, and a real dream come true to hear him cite #AlphaZero as one of his current inspirations! What a time for both human and computer chess! 
https://t.co/F73CQm2A9C https://t.co/xLi9Blspdp"
Huge congratulations to Kim Stachenfeld @neuro_kim for being listed as one of MIT @techreview's #35InnovatorsUnder35 - very well deserved! great to see the contributions of neuroscience to thinking in AI being recognised. https://t.co/57qr4zkgc6
Huge congratulations to Karen Simonyan for this highly prestigious award!! Karen has been a pioneer in machine learning and computer vision for a long time and has been involved in many of the most important projects at DeepMind. Thoroughly deserved! https://t.co/sl0t78Zpvp
"There are so many ways that machine learning and AI can help with #ClimateChange, lots of great ideas for cross-field collaboration in this excellent paper by @david_rolnick, Yoshua Bengio and many other colleagues who deeply care about this topic. https://t.co/1YEhpMMSoc"
"Great to see 1000 new AI conversion degree scholarships for people from underrepresented groups - a good step on the vital mission of ensuring AI opportunities for everyone. Proud of our work with Cambridge, Oxford &amp; UCL offering scholarships in support of this. Lots more to do! https://t.co/VTUPcHkGUv"
Recently I had the honour of giving a public lecture at @the_IAS at Princeton on the potential of self-learning systems. The talk is now available here: https://t.co/FUjZRv1vxq It's a wonderful place to think deep thoughts!
"really pleased to see this NYT obituary for Alan Turing - one of the greatest scientists of all time, but treated shamefully. https://t.co/C40AAatJ4a"
"Our new @sciencemagazine paper is out!! We trained multiple agents to work together as a team to play Quake III Arena: Capture the Flag. These population-based training methods are proving to be widely applicable, e.g. as an integral part of #AlphaStar: https://t.co/q2Z6zDTwv5 https://t.co/nOTvNGXMeq"
"Leela Zero (an open source chess program based on #AlphaZero) has just won the top computer chess competition, beating Stockfish in the TCEC15 final https://t.co/BaAvvAgHtt Great to see learning systems come out on top. Huge congrats to the @LeelaChessZero team and community!"
"Great interview with Fan Hui:
“Before I played #AlphaGo, I felt like I knew the world, like I knew many things. But afterwards, everything changed. Now I really believe everything is possible, because I saw something that people thought was impossible.” https://t.co/5ullCpYmhR"
"@Liv_Boeree @LawrenceTrentIM yes probably that would have been a good idea. the position was equal after 14 moves at least (see position), then I decided to get adventurous which was a mistake..."
"Such a privilege and so much fun to play some blitz chess against the great Vladimir Kramnik, the former World Chess Champion, (I lost!) and to discuss the unique playing style of #AlphaZero https://t.co/FGJyxdT5Tx"
Thanks Nihal! Hope you find the book useful and inspirational! #GameChanger https://t.co/MgHEE880w4
"I had a wonderful time visiting @the_IAS at Princeton, such an honour to give a talk at the home of Von Neumann, Godel, Einstein et al. Thanks @RHDijkgraaf for hosting me, and it was amazing to get to visit Einstein’s house (!!), the IAS is a truly inspiring and special place! https://t.co/0eKKxR0z71"
"Was fantastic to meet the great @danieldennett last week and discuss the nature of intelligence, self-identity, qualia and of course consciousness (along with @mpshanahan). To be continued soon I hope...! https://t.co/yiUvNtcnrF"
Incredible European night under the lights at Anfield! Best match I've ever seen in 35 years of supporting them. With Liverpool literally anything is possible - that's why I love this team!!! #YNWA #LIVBAR https://t.co/T4ri5yc0YQ
"If you’re interested in what deep reinforcement learning could teach us about how the mind works, take a look at our latest paper: “Reinforcement learning, fast and slow” https://t.co/WkAzrhekCg"
"My recent talk at @MIT which covers a lot of our exciting new work applying AI to chess, StarCraft 2, and protein folding is now available on youtube here: https://t.co/JCNRrlTRQU #AlphaZero #AlphaGo #AlphaStar"
"incredible game from @MagnusCarlsen, he is an absolute genius. fabulous pawn sacrifice to open up files and diagonals against the king. Very reminiscent of what #AlphaZero likes to do and explained in ch.11 of the Game Changer book: https://t.co/wKObEuTQA9 https://t.co/V8KNMTtfle"
so incredibly cool... https://t.co/0gehX18Gr9
"Always a great pleasure to be back at @MIT, catching up with old friends, and giving a new talk on our latest work on #AlphaZero, #AlphaStar and #AlphaFold. Sorry to those who didn’t get in to the lecture hall but the video is posted here: https://t.co/0P0ivCXOw9"
Thanks for visiting @AndrewYNg. Great to chat to you too! https://t.co/nBa4JJVCTI
@vicentes @StanDehaene recording coming next week...
@michaelbolton and one Brit! :)
"Huge congratulations to @geoffreyhinton, @ylecun, and Yoshua Bengio for winning the Turing Award (the highest honour in Computer Science). Richly deserved recognition for pioneering deep learning and their outstanding contributions to modern AI
https://t.co/fl4VsVsvRo"
"Really excited to be opening a new office in London next year! Our vision is for it to be the ideal environment for AI research, science &amp; collaboration. https://t.co/GZJHMEMZ3f"
Great to see industry and government coming together to support the next generation of AI talent here in the UK @DCMS @beisgovuk #IndustrialStrategy https://t.co/HsMutwkkv3
"It was a great honour to write an introduction to ‘Game Changer’, the new book by @gmmds, @NatashaRegan123. The #AlphaZero project has really rekindled my passion for chess and I hope this book does the same for others https://t.co/c6GeQmQ9KG"
"“Game Changer ranks with Kasparov’s My Great Predecessors as one of the most important chess books ever written.” - GM Raymond Keene @Times_Chess https://t.co/yLSL1Irsrr
Brilliant new book by @gmmds &amp; @NatashaRegan123 on #AlphaZero out now 
https://t.co/wKObEuTQA9"
"Congrats to @gmmds &amp; @NatashaRegan123 on a great reaction to their awesome new book Game Changer, from none other than @magnuscarlsen!
""It was quite inspirational. I was thinking at several points in the game, how would #AlphaZero have approached this?” https://t.co/vVKMkTGjCQ"
"3/3 While StarCraft is ‘just’ a (very complex!) game, I’m excited that the techniques behind #AlphaStar could be useful in other problems such as weather prediction &amp; climate modeling, which also involve predictions over very long sequences. Peer-reviewed paper is underway."
"2/3 As well as showing how far we’ve come, it was exciting to test out our new prototype system that uses the in-game camera interface to play. Massive respect to @Liquid_MaNa for outplaying it! We’ll keep working on it and play more games soon :)"
"1/3 Really proud to share #AlphaStar with the world - a milestone for game-playing AI, and the first system to beat a top pro at #StarCraft2. Massive thanks to @Blizzard_Ent, @Liquid_MaNa &amp; @LiquidTLO for being part of this great journey!

Blog + Replays: https://t.co/6VBDfiGQsu"
15 minutes to go... https://t.co/glweH8uTgV
"Just a few hours to go to our livestream with @Blizzard_Ent! 

And yes, we will be revealing our new #StarCraft2 system :) 

Introducing… #AlphaStar

Tune in @ 6pm GMT/10am PST/1pm EST: https://t.co/8MLfQ6Uivm  / https://t.co/E7nB3j6IHr https://t.co/iatbUHfNzH"
"The complex real-time strategy game StarCraft II is a long-standing grand challenge for AI - excited to show our progress on Thurs, you’ll definitely want to tune in to the livestream! :-) #StarCraft2 https://t.co/sy2VfHG6dO"
Delighted to welcome reinforcement learning pioneer Satinder Singh to @DeepMindAI. He’ll bring some incredible experience to the team and I'm really looking forward to working with him!
"@ylecun @IRudyak yes agreed, I think it is a classic analogy, and has been around for a while. and yes also agree that many people are trying to copy how the brain works at too low a level, but we have always believed that systems-level neuroscience has an important part to play in developing AI"
"@ylecun @IRudyak no, i've been saying that for a very long time, and it is an obvious analogy (which is why we both ended up talking about it). It's why I always say we are interested in systems neuroscience (or the top two levels of Marr) at DeepMind not the implementation details of the brain"
Really proud that we are supporting these scholarships. Broadening participation in AI &amp; computer science is critical. Please share/apply! https://t.co/ljDNsTDCVg
"in case you missed it, the pdf of the article is now available here: https://t.co/cKJDhE2ALD"
another great article on #AlphaZero covering its evolution from #AlphaGo https://t.co/77WYWkYURp
"Enjoyed this thoughtful essay from famed mathematics professor @stevenstrogatz on #AlphaZero. I see AI as a powerful scientific tool, analogous to the Hubble telescope, allowing us to see further and better understand the universe around us https://t.co/NkpgYdVylb"
@anilkseth Thanks Anil! :-)
@elonmusk Thanks Elon!
Great to see #AlphaZero and #AlphaFold mentioned: The science stories that shook 2018 https://t.co/vXrRJr0iPT
great analysis from @kingscrusher on a very interesting innovation from #AlphaZero in the very common and highly studied Giuoco Piano opening https://t.co/rpsf2jKaNX
"""There is a tremendous, almost tangible, sense of intellectual excitement. It feels fizzing, like there could be anything behind the doors"" - I love this description of life at @DeepMindAI in a great article by @whippletom in @theTimes today: https://t.co/X5pIftjNJR"
Look out for the brilliant forthcoming book 'Game Changer' published by @NewInChess in Jan 2019 by GM @gmmds and WIM @NatashaRegan123 unpacking the secrets of #AlphaZero’s style https://t.co/wKObEuTQA9 great video analysis too: https://t.co/gNbwldF2y6 (2/2)
"Superb analysis of Game 3 by Grandmaster @DanielKingChess: “I mean this is unbelievable chess!” “These games are just so fascinating, we can learn so much from them” https://t.co/GjooXcgrGp #AlphaZero (1/2)"
"""It’s like discovering the secret notebooks of some great player from the past"" says Grandmaster Matthew Sadler @gmmds in a great article from @sarahknapton https://t.co/P2yn2IKCYk"
"@pierre This is purely in the context of chess and self-play training. Of course I agree with you that in the broader context much more work needs to be done on important topics such as fairness and bias, and we and others are pushing research forward on that and other related issues"
"""Programs usually reflect priorities and prejudices of programmers, but because AlphaZero programs itself, I would say that its style reflects the truth."" Awesome words from the brilliant @Kasparov63 - read Kasparov's insightful review of #AlphaZero here: https://t.co/bqhrAF2A5m"
"The full peer-reviewed #AlphaZero paper published today in @sciencemagazine https://t.co/eThRIHaJyw
along with more than 200 games which show off its beautiful style https://t.co/MaNhqlUpmr I hope you enjoy them!
as a chess player, it feels like chess from another dimension :) https://t.co/CDDP5PqNsv"
"Using AI to help scientists tackle the big questions and better understand the world around us, has always been my dream and is the reason I’ve dedicated my entire career to building AI. Just the start of the exciting advances I think we will see over the next decade! #AI4Science"
"Using AI to help scientists tackle the big questions and better understand the world around us, has always been my dream and is the reason I’ve dedicated my entire career to building AI. Just the start of the exciting advances I think we will see over the next decade! #AI4Science"
"Thanks to the CASP community for organising such a great benchmark, the gold standard for assessing protein folding techniques. Congratulations to the Science Team at @DeepMindAI on this fantastic achievement! https://t.co/GyuOU2e8wj (#AlphaFold is listed as ‘A7D’)"
Proteins are essential to life. Predicting their 3D structure is a major unsolved challenge in biology and could impact disease understanding and drug discovery. I’m excited to announce that we have won the CASP13 protein folding competition! #AlphaFold https://t.co/jGXR3e0lfh
New Go book written about AlphaGo's early 3-3 move innovation that all the pros are playing now #AlphaGo https://t.co/H7u6h5kkv0
"@Jonathan_Rowson hah, nice find @Jonathan_Rowson ! I still dont know how we managed to somehow not to win the cup by blowing the last round against the netherlands. we had such a strong team..."
A real honour to make the ceremonial first move of match 8 of the World Chess Championships today. The sheer intensity and focus in the room was really quite something to behold - an amazing experience! @MagnusCarlsen @FabianoCaruana #CarlsenCaruana https://t.co/oi7wacSkjv
"Great thread, worth reading from @Dominic1King, head of @DeepMind_Health and Streams, and former top NHS surgeon. https://t.co/K8IofoxfD6"
Really proud to support @UniofOxford in extending these scholarships and helping to broaden participation in computer science. Open for applications now! #OxfordAI https://t.co/wBbcCFKe7q
"We are immensely proud of all the Streams team has achieved. DeepMind will continue to lead the way in fundamental research applying AI to important science and medical research questions, in collaboration w/partners, to accelerate scientific progress for the benefit of everyone https://t.co/msy808pJVA"
@FogleBird @GMJuditPolgar yes
Awesome day at the World Chess Championships in London yesterday watching Carlsen vs Caruana. Also great catching up with old chess friends including the brilliant @GMJuditPolgar – last time we crossed paths was at a tournament 30 years ago! #ChessConnectsUs #CarlsenCaruana https://t.co/Y0oXqAIbg8
fun and wide-ranging conversation as always with @bbckamal and @Silva ! this is going to be a great podcast series... https://t.co/5TQb6RP4If
"@spconnolly Hi Sarah, the whole performance was breathtakingly amazing! I hope we get the chance to meet too, perhaps at tomorrow's or Friday's performance? I couldnt see the board that well, but I was super-impressed that you could sing and play chess simultaneously at all! #RingCycle"
Had a really enjoyable conversation at @royalacademy speaking on a new topic: creativity and AI (new stuff from 29m). Fascinating ideas and dialogue always happens when the arts and sciences come together. Important for society to understand tech advances through both lenses! https://t.co/ecqOvs5J2n
"The study made the Editor's Choice in Science, nice short summary in the neuroscience section: https://t.co/VHwqvRCeqm
Congrats to @dharshsky @raphael_koster @MartinJChadwick and the team! https://t.co/t1q9jbIkEO"
"Congrats @MoxiePictures @ReelAsDirt for winning the Technology &amp; Innovation category for @AlphaGoMovie! If you haven't seen it yet, you can still watch it on @Netflix @GooglePlay @PrimeVideo #AlphaGo https://t.co/h0I4cmA3Uf"
"I hope readers will enjoy this resource from our safety team, which lays out three categories of AI safety research - specification, robustness, and assurance. It’s been exciting to see the rapid growth of this important field! https://t.co/sdTwa35uos"
Great write-up of my discussion with @tomstandage about the promise of AI at #EconInnov last week! @TheEconomist https://t.co/oXhPC3yUVV
"excited to announce our partnership with @unity3d, if you are interested in creating amazing virtual environments for developing and training AI, we have a number of cool roles, please apply: https://t.co/och4U7squv https://t.co/jU2E0yHzcQ"
@dom767 @DrAlanMurta would love to remake this one day with modern AI... :)
Awesome work led by @dharshsky and the neuroscience team in collaboration w/@DuzelLab using ultra-high-resolution 7T fMRI to show how recurrent interactions in the hippocampal system integrate information across episodes - many implications for AI systems https://t.co/5tU1aOvv10
UCL has held a special significance for DeepMind since @ShaneLegg and I met as postdocs in the Gatsby Unit. It means a lot to support the university's groundbreaking AI research with this new Professorship @UCLAlumni https://t.co/AUsJzAV7Iy
"@bennedik yes the paper is still under review. unfortunately the peer review process at journals takes a very long time, but ultimately the paper is usually the better for it. sorry for the wait but this is not something we can do anything about. thanks for your patience."
"@tim_g314 @jimalkhalili @BBCFOUR yes sorry, it is BBC so UK only unfortunately..."
"Great to see The Joy of AI with @jimalkhalili on @BBCFOUR tonight! Really fascinating look at the potential of AI. In case you missed it, it's available to watch on iPlayer now https://t.co/QETylMyP3n #TheJoyofAI"
"Excellent summary of #AlphaGo Zero from @sirajraval. In general, his videos are a great introduction to AI algorithms: technical yet accessible, and also entertaining - a rare combination!! https://t.co/2LAecUv3pI"
one of the most important aspects of the work is the interpretability of the system so clinicians can see and understand how the system is making its recommendations https://t.co/NMa0IB5BnY
"So proud of the collaboration between the @DeepMind_Health team and the world-class @Moorfields hospital, and the new study published in @NatureMedicine today. Great to see this technology addressing real-world problems, and in the future helping to improve patient outcomes https://t.co/VZzwtvnY8g"
"awesome work from the DeepMind team on scalable verification in deep neural networks - an important step towards provable guarantees of robustness for increasingly general classes of models. huge congrats to Dj, Pushmeet, and the rest of the team! #AISafety https://t.co/elSVooERBR"
"I have so many wonderful memories from my time as an undergraduate at Cambridge, and it’s now such an honour that @DeepMindAI is able to contribute back to the Department of Computer Science and Technology and support others through their studies @Cambridge_Uni https://t.co/6Ix9USYOlA"
"@ProfArno Thanks Polly, likewise, really great to meet you and hear about your brilliant work!"
"Wonderful day at the @royalsociety! Amazing to sign the 350-year old charter book with all my heroes including Alan Turing. The ultimate honour for a scientist. Was fun to do it with @elonmusk, my postdoc advisor Peter Dayan, and all the other great scientists elected this year https://t.co/736dNjO7U9"
Fantastic to see such an ambitious plan for the UK's infrastructure - congrats to all the team at the NIC who I know have worked so hard on this! #UKInfra2050 #NIA https://t.co/0ZaFJCnTPs
"Our latest work demonstrates how agents achieve human-level performance in a complex first-person multiplayer game, and can even collaborate with human teammates! https://t.co/0FEKQIVIi9 https://t.co/UujmnrBXUz"
Honoured to be taking on the role of Adviser to the Office for AI and excited about the opportunity to help the UK stay at the forefront of developing safe &amp; ethical AI https://t.co/lPuciGDK7B
I’ve long been fascinated by how the brain constructs images in the mind’s eye. Our new @ScienceMagazine paper intros GQN: a model capable of recreating a 3D representation of a scene from a handful of 2D snapshots + rendering it from any new camera angle https://t.co/o5WC8qLo4N
"@catherinebuk Once when a top university sent someone to recruit me away from my non-academic job, he referred to profs who work 5 days a week rather than 7 as “lazy faculty.” No thanks!"
@catherinebuk Exactly!
"@MMKamani7 @BikalpaN @thegautamkamath As someone who organizes other conferences, I’m interested to know: how does the travel ban prevent travel to Canada? Do all the affordable flights have stops in the US or something?"
"@KordingLab That suggests that maybe arxiv is enough for this paper itself, but in order to unlock this paper’s effects you should work on helping neuroscientists to think about ANNs more"
@KordingLab The “Ian reads it” variable is d-separated from the “conference / journal publication“ variable given the “Tim+Konrad wrote it“ variable
@KordingLab Who do you want to read it? How do you want the world to change as a result of the paper?
@oh_that_hat Which book?
My team at Apple is hiring in Zurich: https://t.co/NzNncDGB5K
@NalKalchbrenner Can it make a better GAN discriminator due to better estimate of D* = p_data / (p_data + p_model)?
@GoAbiAryan https://t.co/dWWrYIdTha
@greyesgt @Apple Congratulations!
@AndrasRozsa1 @ChrSzegedy Jonathan Uesato wrote the paper introducing it
"@AndrasRozsa1 @ChrSzegedy (With the early stopping you won’t actually run for the full 1000 for most examples, so this experiment is not as expensive as it sounds)"
"@AndrasRozsa1 @ChrSzegedy 2nd most important is the number of iterations, definitely try at least 1000"
"@AndrasRozsa1 @ChrSzegedy Most important hyperparameter is early_stop_loss_thresh = 0. This makes it terminate when it finds a misclassification, rather than running for some fixed number of steps"
@AndrasRozsa1 @ChrSzegedy You definitely need to do some hyperparameter search to make it a good adaptive attack. But it should get an undefended model to 0 easily
@AndrasRozsa1 @ChrSzegedy I was working on streamlining the process as of when I left Google but I didn’t finish it: https://t.co/3NcdTUcu85
@AndrasRozsa1 @ChrSzegedy So to be clear: (1) I haven’t been involved in CleverHans development since March and I don’t know about the future module (2) I haven’t used or developed any of the pytorch code
@ChrSzegedy @ch402 I don’t mean the previous tweet as a criticism of any existing paper. I mean it as an explanation of why I don’t think it’s a priority to publish the red-releasing checklist
"@ch402 @ChrSzegedy Also, the checklist is mostly about expectimax adversarial examples. A static model that passes this checklist would still be worthless in practice. I encourage to switch to studying the dynamic case: https://t.co/b5XgyGi3KS"
@ch402 @ChrSzegedy The Google internal release checklist was (is?) much more specific (down to hyperparameter values that must be included) but my co-authors of the public doc didn’t want to get that specific.
@ch402 @ChrSzegedy We wrote this doc in collaboration with other labs: https://t.co/4VK6tdC9km
@ChrSzegedy In general it would be much better if authors of the first defense paper would follow the recommendations here: https://t.co/NfZA9hbXEa Many ideas that seem to work for direct PGD attacks and transferred PGD are then easily broken by SPSA or random search.
"@ChrSzegedy It looks like they did not evaluate using the SPSA attack, which would have been required before getting pubapproved from my team at Google, as of when I left. They also didn't evaluate on noise / random search. Both are standard ways to test the defense isn't gradient masking."
"@ChrSzegedy Yes, I acknowledge maybe a new twist makes it work. But in this field nearly all apparent positive results are false, so I’d be skeptical a priori. I’d be interested in an independent evaluation."
@ChrSzegedy Yes
@ChrSzegedy BN certainly *helps* training but little tiny MNIST models like this don’t need much help to train successfully
