"The @PartnershipAI team includes an incredible board—@erichorvitz @easears @mustafasuleymn @greg_corrado @ACLU @OpenAI @jasonfurman @rao2z @frossi_t @ylecun @apple @rherbrich &amp; Deirdre Mulligan—and a community of 50+ Partners spanning tech, civil society, and nonprofit orgs."
Thrilled to announce that the Partnership on AI is hiring! Details on joining our growing organization below: https://t.co/V1xui70VvI
"This is such a fantastic approach to building the (multidisciplinary, diverse, inclusive) future AI field: https://t.co/Rv01D7vOsU"
"@amac @corizarek @KumarAGarg @mc4llister @emcooke Definitely still use that, every single day..."
@corizarek @KumarAGarg @mc4llister Would just like to +1 “nothingburger” (+ @emcooke)
In fabulous company here—among many other groundbreaking women leaders in the AI and tech policy field not mentioned but doing great work every day to move the ball. https://t.co/4Uz36ldq0O
"DeepMind's @mustafasuleymn with important words about the hard, high-stakes work to be done this year in finding out what ethical AI really means: https://t.co/GOJIo7AWrX"
"@robseamans @geekwire @EdFelten “The bill asks...to establish a group of experts from tech companies, research institutions, manufacturing, civil liberties groups, and government to study and predict the impact AI will have on society.” This type of multistakeholder group sounds much like the Partnership on AI."
@robseamans @geekwire @EdFelten The NSTC Subcommittee in Machine Learning and AI is a cross-agency group comprised solely of government representatives.
Your comments were very inspiring Jeff! Thank you! https://t.co/bozOGw80sK
Oh wow! This melts my heart! https://t.co/BuYWoM3OgT
"2) providing compute resource opportunities for African researchers &amp;students; 3) encouraging African academia to foster more AI/ML research, such as ML programs and departments; and 4) encouraging more policy support to AI/ML education and research. @DeepIndaba #DLIndaba2019"
"1) Just had a wonderful conversation with machine learning &amp; computer vision students from Africa! They gave some wonderful suggestions on how we can all help them by 1) creating and encouraging more collaboration and mentorship opportunities globally, @DeepIndaba #DLIndaba2019 https://t.co/FBFWWWvt7r"
"Great work, team! https://t.co/0hwlWG3fRo"
"So proud of my friend, collaborator, former post doc @StanfordSVL Michelle Greene! I truly look forward to learn more about this research lead by Michelle! https://t.co/Jw0TG6mODy"
"This is our intellectual home, a vibrant community of passionate scientists, curious learners and collaborative colleagues working on some of the most cutting-edge and fun problems of computer vision and #AI in general. https://t.co/MZediFRCOu"
Thank you @CNBCi! https://t.co/zFqolRLKk5
Congrats @tessposner So well deserved! https://t.co/jN7MlmsZcw
Welcome Maryland to join our growing @ai4allorg family! https://t.co/XboN2ehBRi
Thank you Ali! @ai4allorg will be not possible without amazing mentors like you!! &lt;3 https://t.co/reALuY4NJR
"You’re one of the amazing role models for these young @ai4allorg students too! :) and yes, awesome window view :) https://t.co/m49Gji8lqo"
"Conv. Neural Network, LiDAR, regularization, NaiveBayes, robots, NLP, computer vision, precision medicine...these r some of the topics shared by @ai4allorg students today at their final presentation @Stanford! It’s breathtaking &amp;heartwarming! They will change the future of AI! https://t.co/Q4zVNLmFxc"
Very honored and humbled! Looking forward! https://t.co/99yHkJE621
Yay @ai4allorg @Columbia ! We are so excited to begin this journal with you @DrDesmondPatton and your colleagues! https://t.co/h4kTL4VikX
Congrats Marina! You were a teacher of @ai4allorg since 2015 @Stanford . Now you have spearheaded AI4ALL @UCSF ! What an amazing leadership and service! So excited for you and all the students! https://t.co/sNG1WY3Yjw
"“I ask no favor for my sex; all I ask of our brethren is that they take their feet off our necks.” -Ruth Bader Ginsburg(requoting Sarah Grimke). #AI technology might be advanced, but #AI community’s culture still needs significant change. Let’s continue on making a positive diff! https://t.co/dqLVVsSs8z"
"Students @ai4allorg Stanford tonight had a chance to hear from an incredible woman leader in technology and public service, former Undersecretary of Commerce, Michelle K. Lee. Thank you Michelle! https://t.co/tWu6PprTEE"
Wow this is cool! Wish I could visit in person! :) https://t.co/C5ZYMKOph2
What I love about this video is the faces of so many students and colleagues (and robots) I work with! #AI is only made possible by a rainbow of diverse people. And its mission is only meaningful if it’s good for all of humanity. https://t.co/SRt0qFOWmO
Awesome talking to you @kevin_scott ! https://t.co/MdE2jeLkZ1
Looking forward to working with a passionate #AI researcher and leader who believes in the mission of @StanfordHAI and can help us execute! https://t.co/5enECcprFR
Congrats Eric! https://t.co/ZMreyRwRgI
Thank you Oriol! https://t.co/2n6aaT7NvU
"Oh lord, I don’t want to know what @orussakovsky said... ;) https://t.co/9RM9znva9D"
Ending my #CVPR2019 conference as a Crazy Rich Bayesian! Go Bayesians! https://t.co/NEq9qpkaTX
Thank you! https://t.co/EzHknGw5da
Thank you @AnitaB_org for supporting generations of women in computing! Am honored to follow the footsteps of many women leaders to receive the Technical Leadership Award! &lt;3 https://t.co/ZP8iH6aVhU via @anitaborg_org
"@AnimaAnandkumar @deepikabablani @jackclarkSF To be honest, it’s still tough, @AnimaAnandkumar , some times even on a daily basis. But I hope our work and efforts (including @ai4allorg ) will make a difference for the future generations to come. :) The future of #AI must be more inclusive."
Thank you Dirk! &lt;3 https://t.co/AqBlThuglY
Thank you so much Curt! I’m very moved. &lt;3 https://t.co/V7mtAlEkIh
Hehe. Thank you Dirk! https://t.co/AqBlThuglY
Thank you Agrim! &lt;3 https://t.co/MvzbXQkfOe
Thank you! https://t.co/OGCbVKfn4c
Thank you Liangliang! https://t.co/wBEou8Wn1E
Thank you! https://t.co/KZmLfUT1tc
"Proud to be co-organizing this conference with @NatureMedicine , also a @StanfordHAI event! https://t.co/nkbBgLZCw5"
"It’s Commencement @Stanford today, one of my favorite days of the year! I’m a proud advisor of many wonderful students receiving undergrad, master or PhD degrees! Best wishes to you all - make all of us proud! And be a technologist with both smart and heart! &lt;3 https://t.co/AoR4f0EZs2"
Thank you @RepBillFoster for spending time to discuss #AI and @StanfordHAI with us! It was fun to geek out with a high-energy physics PhD on the Capitol Hill. :) https://t.co/47A8c0HWNM
"It was wonderful to have a chance to discuss #AI and @StanfordHAI with you @RepLipinski ! We look forward to continuing our partnership with the Capitol Hill on human-centered AI education, research, practice and policy! https://t.co/JD9MuasejV"
"Thank you @RepMcNerney for hosting us and engaging in a deep, thoughtful and inspiring discussion of #AI with you, members of the Congressional #AICaucus and congressional staff! We look forward to continuing our discussion and partnership! https://t.co/zGKALND8ka"
"Am spending the day on Capitol Hill talking to members of Congress and Senate about human-centered AI and @StanfordHAI . Here is a beautiful quote we see in Capitol Hill, speaking so well of our vision of #AI’s potential to augment and enhance humans. https://t.co/hJfeXAXCZw"
Amazing and so proud! :) thank you @NobleAIofficial https://t.co/5AAMQoJYcQ
Indeed very wonderful conversation today with @WHOSTP to discuss the future of Human-Centered AI! We hope this is just the beginning! :) https://t.co/doDRmQQEeC
So humbled by this given how vitamin-D deficient (a.k.a. too much time spent working indoor in front of a computer) I am! ;) https://t.co/rF0sJGCUzt
Wow! This is soooo awesome! Congrats Dirk!!! Major achievement! So proud of you! :) https://t.co/mEbUrqzu3y
I know! And I was just talking to my current students that #AI wouldn’t be where it is today without the decades of cognitive science contributions leading up to the AI revolution today! It’s an untold and forgotten story of AI’s history! We need more AI+brain science! :) https://t.co/PSS9c7wYqw
"Wow, one year already! Congrats Chris! It’s still like yesterday when you joined my lab almost 10 years ago. So proud of everything you’ve accomplished! #proudadvisor :) https://t.co/p6mmUTVH0W"
"Very proud of my PhD student @yukez for passing his PhD thesis defense with flying colors! His work is on perception, learning and robotics. Thank you thesis committee members @leto__jean @EmmaBrunskill @silviocinguetta &amp; Dan Yamins! https://t.co/gPVUzhaqF1"
"Stanford’s social robot #jackrabbot greeted a group of foreign press friends @StanfordHAI &amp; @StanfordAILab, in collaboration with U.S. State Dept @StateDept — Foreign Press Center Showcases U.S. Landscape of Innovation https://t.co/eBJuy2uS1r"
.⁦@ai4allorg⁩ is part of an increasing global efforts to bring #AI education to k-12. But the key here is not only to introduce the technology but also to ensure a human-centered curriculum that is inclusive. Forbes Insights: AI Goes To High School https://t.co/iDN9Ohd1Rv
A principled human psychophysics approach to evaluate GAN algorithms and images. Fun collaboration with @RanjayKrishna and @msbernst ! https://t.co/1xqFX3Fq7h
Very proud of the work by our team of students and collaborators! Integrating multimodal perception with robotic manipulation is a very promising direction! https://t.co/Bj8ohsiI0X
"A freshly out-of-the-oven @StanfordHAI work highlighting the interdisciplinary thinking of #AI, psychology and neuroscience! https://t.co/AMouFbvnzk"
Could this be you? If you are passionate about creating educational programs and opportunities to the world by introducing them to human-centered #AI at or via @StanfordHAI :) https://t.co/QaGez9kOlG
Exciting! Great leadership from robotics faculty @leto__jean and awesome students! https://t.co/JsBPrB1j5r
Excited by this upcoming workshop! Scene graph has prove to be a powerful representation for high level vision tasks. https://t.co/I7irR8ucgd
"(2/2) While we are at this, here is the link to a conversation between two @ai4allorg alumni and @BillGates at our @StanfordHAI launch event several weeks ago. :) https://t.co/2tP76AWGRW"
(1/2) Thank you Bill for the shoutout! At @StanfordHAI we hope to invite more interdisciplinary thinkers like @harari_yuval to engage in important public discussions and dialogues of AI. https://t.co/M8EqsndOQR
Journalists play a critical role in informing and educating the public about AI. @StanfordHAI is proud to support the work by our first class of journalism fellows in collaboration with @JSKstanford ! https://t.co/XGVDtrpoD4
The full transcript of the interview by @nxthompson for me and @harari_yuval is out. It’s a conversation about #AI and our shared future by a humanist and a technologist. @StanfordHAI We hope to see more such dialogue taking place. https://t.co/BId5eTixmb
"Yuval, it was great fun and a very thought provoking conversation! Thank you for coming to @StanfordHAI and share your thoughts with us! https://t.co/AN6fTjh7hN"
.@StanfordHAI is committed to creating public outreach programs on the important topics of human-centered AI. See the upcoming new course! https://t.co/QrWKMeIWLJ
"“For every one @ai4allorg alum, they go on to educate 10 more [..]and have already reached over 2,500 underrepresented youth thru their own AI [..] initiatives.”Our 5yr old effort in increasing diversity in #AI has reached thousands of students. But a lot more needs to be done. https://t.co/YanO1JpUdH"
Global cooperation and collaboration is one of the goals of @StanfordHAI So glad to have had a chance to discuss the topics of AI with our French friends! Looking forward to more discussions and collaborations! https://t.co/jWBjbGnhCy
"This is an exciting opportunity for #AI and healthcare researchers, thought leaders and practitioners! https://t.co/Y66IA1RhfV"
".@StanfordHAI Associate Director Prof. @robreich leads an important class on computing and ethics. The new generation tech thinkers ought understand ethics, policy and human conditions better. https://t.co/3QnPS3V06H via @Stanford"
Thank you @jessiwrites It was fun talking to you! https://t.co/1sV4AoHlNL
The history of science has been written by many women. But the history of women scientists needs to be written much more fairly. This mission is far from being accomplished yet. https://t.co/LXo0mwACVe
It’s an honor to participate! I’m looking forward! https://t.co/1Sfycca7zY
"Spring classes have begun! Am back to the podium of CS231n with @jcjohnss and @syeung10 ! Very exciting to see a new crop of 600+ students. (When I started teaching 15 years ago, my entire class size was about the size of my current TA group ;) https://t.co/MMJP6DofIP"
Very much looking forward to this! :) https://t.co/tKIC2ElyLX
"Welcome @UMich to join @ai4allorg as our newest summer programs inviting women and underrepresented minority groups to study and participate in AI, starting from high school age! This is the 11th campus we’ve started since 2017! https://t.co/jvLbsLLl2Q"
"To be precise, “this community” is @StanfordHAI And it’s still growing! We need more diversity of people and thoughts to work on AI. https://t.co/ecp4taern1"
Thank you @techreview for the invitation. https://t.co/PdMEbd7SU1
Great article @techreview on work by @syeung10 and our AI+Healthcare team! https://t.co/z46RAdhEaV
Thank you Eric! There is a lot for us to do on #AI-enhanced and assisted medicine and healthcare! https://t.co/DHzkibFxB6
"Garry, this means a lot to me and @StanfordHAI ❤️ We will do our best! https://t.co/b6eJgHgMnv"
I love this infographic done by the @StanfordHAI team that summarizes some of the history of AI and @StanfordAILab : https://t.co/zgjCbkIx29
Thank you Terah! Let’s partner! :) https://t.co/dwUulgHrFU
"BIG NEWS! @StanfordHAI says “hi” to the world! :) We are launching the biggest effort ever in human-centered #AI research, education and public outreach! https://t.co/byZRlpvsUH"
The work by @EdFelten44 and Olga Russakovky inspire me everyday! https://t.co/L4p1MD8jW0
".@stanford students, pay attention to this! Judea is a giant thinker in the world of statistics, ML and AI! https://t.co/h159KKrAY1"
“100% of AI4ALL alums feel #AI can improve the world and their community.” It’s awesome to have @ai4allorg CEO @tessposner giving a guest lecture at my class Designing AI for Human Well-Being with Jennifer @aaker https://t.co/AZmghAnoQC https://t.co/hA5W54Tyr5
"Aww @AnimaAnandkumar , you are my hero too! And an amazing role model for many women in machine learning! https://t.co/lQYGrQvjjz"
Our new work on learning from video demonstration -- using compositional graph representation. Such capability will be essential in training robots in the wild in the future. https://t.co/SPT6V69Hsn
"ICU is where patients fight for life, and 1% of GDP spent every year in the US. #AI has a potential to help more patients and clinicians. Proud of our paper published today on Nature Digital Medicine @Nature_NPJ https://t.co/qyGTIN7vZQ"
New #AI #job opportunities available! The Human-Centered Artificial Intelligence (HAI) Institute @Stanford invites applications for fixed-term Assistant Professor (Research) faculty positions. Here are more details: https://t.co/OUQyC3poJi
Congrats Eric! https://t.co/VcZqazrKbf
"Wow @UvA_Amsterdam, I’m truly surprised and humbled! It’s heartwarming to see the celebration of women scientists world-wide! And thank you for the acknowledgment of @ai4allorg ! &lt;3 https://t.co/BEq6hYmckt"
"Love this picture and work of my former student, incoming @stanford assistant professor @syeung10 ! https://t.co/OULNfXPxjD"
"Stanford’s AI-assisted Healthcare is calling for research abstract submission and participating in an upcoming fall conference on #AI and healthcare, partnered with @NatureMedicine More details here: https://t.co/kg4fz3aSqH"
"“AI will change the world. Who will change AI?” Our @ai4allorg programs are expanding to 10 campuses in America in 2019! High school students of diverse background, please consider participating! https://t.co/EE0oXaN53Z"
"Journalists friends, see Stanford’s new Human-Centered AI Institute journalism fellowship! Communicating AI thoughtfully and effectively is a huge responsibility and opportunity. https://t.co/mfSZbBkwfo"
"A beautiful blog post by Surya, associate director of Stanford’s Human-Centered #AI Institute @StanfordHAI on “The intertwined quest for understanding biological intelligence and creating artificial intelligence.” https://t.co/wEPZH9wSOZ"
Honored to be part of this. Thank you Martin! https://t.co/roQIH5udyL
"Very proud of the AI+healthcare work by our @ai4allorg alum Amy Jin, my former PhD student @syeung10 &amp; our collaborators at Stanford's PAC team (https://t.co/1gZEEsexKx). Love the pictures of the students ;) https://t.co/vO7TPyBXs9"
"Here is our first blog, explaining why it is our opportunity and responsibility at this historical time to invest basic science #AI research and education in academia and why Stanford has a special role to play: https://t.co/PTJ2YrWFiH"
"Stanford today soft launches our Human-Centered AI Initiative. I’m very excited to be co-directing this initiative with former provost John Etchemendy. Our mission: To advance #AI research, education, policy, and practice to benefit humanity. @Stanford https://t.co/ddDbHVVS0C"
So proud of @ai4allorg 's @Princeton inaugural camp for underrepresented minority students. Kudos to @orussakovsky and @EdFelten44 for putting together a wonderful program of not only #AI technology but also policy and ethical considerations. https://t.co/5eeHLcmnBN
@Oesophagusuk @westfieldlondon @thomasdolphin Thanks Chris. I now follow Tom on Twitter so I don’t risk being unoriginal again. Hopefully we’ll cross paths in the mall
I wonder what the ‘limitless’ drip is. Subcutaneous fluids until the end of your shopping trip?
@mike_johnson @westfieldlondon Extra £125 to get the fitness drip. Ingredient in that more expensive than the already expensive salt water!!
@bcdelaney1 @westfieldlondon @gmcuk @MHRAgovuk For the good of society I was tempted to do a mystery shopper test. But I was frightened they’d pull out an orange cannula and use the lurid red bag of ‘vitamins’ on me. Selfishly chose to get a donut instead
I make it a habit to avoid shopping centres so this may go for normal now. But had a wtf moment @westfieldlondon seeing people having iv infusions next to the nail bar &amp; donutteria. Today’s special was a ‘retail therapy drip’ at £100 https://t.co/QXIhasPCyq
"Great to see this work by @pearsekeane and @DeepMindAI colleagues published. We can encourage a diverse community of applied healthcare AI researchers by democratising tools, supporting education and training and making open datasets available https://t.co/vgWRptJqvN"
Blog post from the @DeptVetAffairs about our research partnership where we explored whether an AI system could detect life threatening kidney problems. We’re now thinking carefully about how this progress can translate into real world practice https://t.co/h2DHF52TY1
@chrissyfarr Journos aren’t alone. Plenty of studies showing how bad doctors are at interpreting stats. One example —&gt;  https://t.co/eSa3qRLu1P
@vgul As a VC you’re good at choosing between options Vishal
London (2/2) https://t.co/2JZonMxVxx
San Francisco or... (1/2) https://t.co/kj9og4wk4X
"A must read for the healthcare AI community. We need to ensure that we are choosing the right problems to focus on, developing useful solutions, considering ethical implications, rigorously evaluating and report results and deploying AI responsibly https://t.co/P1hIHmCWve"
Great to hear that identification and treatment of sepsis seems to be improving. I may have missed it but is there a link to the published evaluation supporting the figures presented here https://t.co/AsTYQtjc33
@NickFerran @thomasllewis Particularly in later stages of training I think you should stay in a department for at least a year. Trust needs to develop on both sides. Speaking to US colleagues who stay in same (large) hospital describe major benefits with fellowships used to broaden experience
I found frequent team &amp; place changes in medical training tough. By time I felt settled and had built good working relationships it was time to move on. Real benefits to being in a small number of sites where trainees &amp; hospitals feel invested in making it work for both sides https://t.co/Q2CXPzjw4T
@TrevorBack @FryRsquared Ha. I’d actually written the moon first then decided you may be more inclined on discovering a planet and changed it.
@TrevorBack @FryRsquared Just need to discover a new planet now?
Brilliant to see Louisa Aldrich-Blake one of Britain's first female surgeons on Google Doodle today. Reading her background she did pioneering work in rectal and trauma/war surgery as well as gynaecology. On the side she also did some anaesthetics... Remarkable https://t.co/11IlxGjjBL
Really interesting observational study showing of all the current alerts/alarms going off in the Emergency Department staff didn't observably respond to most of them (63%) &amp; clinical management changed care in only 0.8% of cases!!! https://t.co/3fiJLIrSwx
"Recommend this article in @TIME. Article on healthcare AI covering both its promise (improving access to care, reducing medical errors, freeing up clinicians time) alongside the risks (worsening existing biases, privacy and safety concerns) https://t.co/YdimxMl79Y"
It’s bad enough that individuals carelessly leave dockless bikes on pavements causing problems for people like Dr Kavanavgh. But the bike companies themselves place bikes in such inconsiderate places. This is right outside a major London hospital today https://t.co/TAD8jX3TKM https://t.co/wMQisJY5oG
Great to see this work published. Pressure on pathology services across many health systems leads to delays in patients getting a diagnosis and their treatment started. We need smart solutions like this as digital pathology services (unlike radiology) aren’t yet widespread https://t.co/MAlgOTcHgm
@DrHughHarvey On device machine intelligence. State of art!!
AI powered toothbrushes. What a time to be alive... https://t.co/FH5oVA0YMe
"@HarryAEvans @DrHughHarvey Adds weight to my hypothesis that no tweet about health technology generates as much interest as one involving pagers, fax machines and/or WhatsApp.."
"@Maxi_Macki @rijan44 @DrHughHarvey @HarryAEvans Thanks Max! Hugh we felt use of WhatsApp within clinical teams had potential for 'improving patient safety' by flattening hierarchies, increasing team connectedness and enhancing senior support &amp; supervision. Obviously @ForwardHealth_ or @MedicBleep weren't around at the time!"
@HarryAEvans @DrHughHarvey Conclusion of our paper was that WhatsApp was a safe and effective communication tool for clinical teams. Highlight for me was the witty title of the paper https://t.co/EkcvGt1KiF
@jessRmorley @IndraJoshi10 And mathematicians to develop the algorithms 👩‍🏫👨‍💼?
This is interesting &amp; welcome! In building and deploying its own algorithms @NHSX will better understand and be able to support the wider ecosystem with the challenges of making this technology work in the real world. Good luck! https://t.co/REQe8gNiqP
@NandoDF @Uber Did you have your car rental issues in Sardinia? We had the problems last month with an outfit called b-rent at Olbia airport. They said that because I didn't have a 'gold' credit card I has to pay 3 x the original cost of the car in extra insurance...
Recommended non healthcare focused read in @HarvardBiz. ‘Embracing AI in workflows affords better processing of structured data &amp; allows for humans to contribute in ways that are complementary’. https://t.co/iHjgP7QOKH
@FarmerFunster @DeepMind_Health @DeepMindAI @nature This ultimately becomes easier with digitalisation of the medical record and the ability to measure activity and outcomes across a granular pathway. In addition mobile solutions offer opportunities for the delivery of realtime insights to the right clinician/patient
@juliapowles @DeepMind_Health Hi Julia. I’m OoO - hope this link works https://t.co/eJp2hVW2Fm
V.excited about potential for our healthcare AI research published in @Nature this week. But most proud to hear Mary a nurse @RoyalFreeNHS say we've supported her with technology that already makes a big difference to her job &amp; 'fits with the way we work' https://t.co/WD8f5qj8l2
"@ellarose146 Hi Ella. In most cases, nephrologists and outreach nurses are triaging patient on mobile with relevant information available and only go and see patients they're concerned about. Worth reading qual paper that explored benefits and challenges of technology https://t.co/9i3L7RTVB8"
@MartinBromiley @DeepMind_Health Thanks Martin! Hope you're well. We learnt much from your  recommendations +@alana_designs
@billlaughey @DeepMind_Health Thanks Bill
"@FarmerFunster @DeepMind_Health @DeepMindAI Hi Johnathan. Our primary motivation is improving patient outcomes but we need better ways of identifying preventable patient deterioration. That's why we've also been exploring the role of AI systems. Worth reading Eric Topol's @Nature editorial
https://t.co/jKh0E4Ax2t"
@MannaElaine @DeepMind_Health Thanks Elaine. We're all grateful for your ongoing support. See you soon
